{
  "schemaVersion": 2,
  "id": "kuumetsu-hunt-hud-hierarchy-20260921",
  "game": "kuumetsu",
  "mode": "polish",
  "kind": "gameplay",
  "themeKey": "hunt-hud-decision-hierarchy",
  "rootCauses": [
    {
      "key": "zero-stake-hud-noise",
      "summary": "The immutable opening HUD gives zero-value haul text equal weight to the actual prey objective.",
      "prediction": "At zero carried stake the haul token is absent while prey progress remains visible.",
      "falsifier": "The opening HUD still renders a zero-value haul token beside prey progress.",
      "paths": [
        "apps/demon/src/web/hunt-flow-ui.js",
        "apps/demon/src/web/hunt-minimal-hud.css"
      ]
    },
    {
      "key": "pressure-salience-flat",
      "summary": "Quiet and dangerous response pressure occupy the same persistent visual slot, weakening the moment when risk actually escalates.",
      "prediction": "Quiet pressure stays latent and level 2/3 pressure gains explicit visual weight.",
      "falsifier": "Quiet pressure remains persistent or high pressure is visually indistinguishable.",
      "paths": [
        "apps/demon/src/web/hunt-flow-ui.js",
        "apps/demon/src/web/hunt-minimal-hud.css"
      ]
    }
  ],
  "observation": {
    "summary": "Immutable staging opens the first hunt with `人影 0/2`, `戦利 0 · 未確保 0`, and `警戒 静穏` as peer-weight HUD tokens. The player has no stake and no danger yet, so two of three persistent tokens describe zero-action state.",
    "staging": {
      "kind": "immutable-staging",
      "sourceSha": "afde80d27a314f3c86e9ef8e6028d90b5c6b15cf",
      "reference": "https://82dcf557-soul-lineage-demon-dev.c-okamoto.workers.dev/",
      "observedAt": "2026-09-21T12:47:00Z",
      "conditions": {
        "viewport": "673x841",
        "device": "GitHub hosted Chromium / SwiftShader",
        "scenario": "fresh profile -> TAP -> first hunt, 1.8s after begin"
      },
      "notVerified": [
        "physical Pixel Fold appearance",
        "post-consume high-pressure screenshot"
      ]
    },
    "evidence": [
      {
        "kind": "browser",
        "revision": "afde80d27a314f3c86e9ef8e6028d90b5c6b15cf",
        "path": "immutable preview",
        "symbol": "first hunt HUD",
        "statement": "Visible text contained 人影 0/2, 戦利 0 · 未確保 0, 警戒 静穏."
      },
      {
        "kind": "source",
        "revision": "afde80d27a314f3c86e9ef8e6028d90b5c6b15cf",
        "path": "apps/demon/src/web/hunt-flow-ui.js",
        "symbol": "HuntFlowUi.update",
        "statement": "Goal, haul and pressure are always populated with no zero-state suppression."
      }
    ]
  },
  "hypothesis": {
    "cause": "The minimal HUD treats absence-of-stake and absence-of-danger as persistent information instead of progressive disclosure.",
    "prediction": "Progressive disclosure leaves the opening prey-first, then introduces haul and pressure exactly when those decisions become relevant.",
    "falsifier": "Opening remains equally dense or native assertions cannot bind visibility to carried stake and pressure level."
  },
  "candidates": [
    {
      "id": "progressive-disclosure",
      "selected": true,
      "reason": "Preserves all existing information and mechanics while changing only when secondary state earns space."
    },
    {
      "id": "replace-hud-with-large-objective-card",
      "selected": false,
      "reason": "Would increase chrome and obscure the world instead of reducing decision noise."
    }
  ],
  "implementation": {
    "paths": [
      "apps/demon/src/web/hunt-flow-ui.js",
      "apps/demon/src/web/hunt-minimal-hud.css",
      "apps/demon/tests/hunt-loop-native.test.mjs"
    ],
    "summary": "Hide zero-stake haul and quiet pressure, strengthen prey progress, and escalate visual treatment only at real pressure."
  },
  "evidencePlan": {
    "objective": "reproducible-causality",
    "focusedTests": [
      "apps/demon/tests/hunt-loop-native.test.mjs"
    ],
    "stagingAfter": "required",
    "limitations": [
      "Portable balance probe does not measure DOM hierarchy; native source assertions are causal evidence.",
      "Physical-device appearance remains outside hosted evidence."
    ]
  },
  "receipt": {
    "repository": "charukun/soul-lineage",
    "pullRequest": 1309,
    "marker": "autonomous-receipt:kuumetsu:kuumetsu-hunt-hud-hierarchy-20260921"
  }
}
