{
  "schemaVersion": 2,
  "id": "village-entry-post-boot-yield-20260921",
  "game": "village",
  "mode": "hardening",
  "kind": "gameplay",
  "themeKey": "post-entry-interactivity-during-enhancements",
  "rootCauses": [
    {
      "key": "entry-click-starts-heavy-work-before-paint",
      "summary": "The village:entered listener starts the optional enhancement loader immediately from the entry click lifecycle, so the browser can begin heavy evaluation before a clean first playable paint.",
      "prediction": "The entry click gets a paint boundary before optional enhancement evaluation begins.",
      "falsifier": "Source/native evidence still starts enhancement import before the paint boundary.",
      "paths": [
        "apps/village/src/main.js"
      ]
    },
    {
      "key": "enhancement-graph-evaluates-monolithically",
      "summary": "mura-enhancements statically imports the whole ordered side-effect graph, allowing multiple expensive modules to evaluate as one uninterrupted post-entry task.",
      "prediction": "The same ordered modules load through sequential dynamic imports with a browser-turn yield between each module.",
      "falsifier": "Enhancements are reordered/removed, or the graph still evaluates through top-level static imports without yields.",
      "paths": [
        "apps/village/src/mura-enhancements.js"
      ]
    },
    {
      "key": "post-graph-presentation-loads-back-to-back",
      "summary": "Character runtime integration and village visual language are loaded immediately after the enhancement graph with no scheduling boundary.",
      "prediction": "Those final presentation stages retain order but yield between stages.",
      "falsifier": "Final presentation stages are reordered or still execute back-to-back in the same cooperative chain.",
      "paths": [
        "apps/village/src/main.js"
      ]
    }
  ],
  "observation": {
    "summary": "After the prior title-screen deferral, immutable staging now makes the title responsive, but clicking 村へ入る produces repeated 1.2–2.1s long tasks during the first playable seconds. The remaining problem moved from pre-entry to post-entry rather than disappearing.",
    "staging": {
      "kind": "immutable-staging",
      "sourceSha": "a923fcc02dfef9a57aad00001bd3daab8786fc07",
      "reference": "https://5bc8d47e-soul-lineage-village-dev.c-okamoto.workers.dev/",
      "observedAt": "2026-09-20T21:43:24Z",
      "conditions": {
        "scenario": "title -> 村へ入る -> 5s first playable dwell",
        "device": "GitHub hosted Chromium / SwiftShader",
        "viewport": "673x841",
        "developHead": "232bc99f00899cb863012ae898b7422ec45cc3ad",
        "targetTreeIdentity": "a923..232bc has no village/package/autonomous-village changes"
      },
      "notVerified": [
        "physical Pixel Fold timing",
        "which individual enhancement module dominates each long task"
      ]
    },
    "evidence": [
      {
        "kind": "source",
        "revision": "232bc99f00899cb863012ae898b7422ec45cc3ad",
        "path": "apps/village/src/main.js",
        "symbol": "loadPostEntryEnhancements",
        "statement": "The entered event immediately begins the enhancement import chain and then loads character runtime and visual language back-to-back."
      },
      {
        "kind": "source",
        "revision": "232bc99f00899cb863012ae898b7422ec45cc3ad",
        "path": "apps/village/src/mura-enhancements.js",
        "symbol": "top-level ordered side-effect imports",
        "statement": "The post-entry enhancement graph is a sequence of static side-effect imports, so module evaluation is not cooperatively yielded between stages."
      },
      {
        "kind": "test",
        "revision": "232bc99f00899cb863012ae898b7422ec45cc3ad",
        "path": "apps/village/tests/first-run-onboarding.test.mjs",
        "symbol": "title entry is a lifecycle boundary before post-entry enhancement loading",
        "statement": "Existing regression protects the entry/enhancement lifecycle boundary but does not require a playable-frame/yield boundary inside post-entry loading."
      }
    ]
  },
  "hypothesis": {
    "cause": "Heavy post-entry work was moved behind player intent, but it still executes as a largely monolithic ordered graph immediately after the click, blocking the first playable interaction window.",
    "prediction": "A paint boundary before loading plus ordered per-module browser-turn yields will preserve every enhancement while eliminating the monolithic post-entry critical section.",
    "falsifier": "Focused assertions cannot prove ordering/yields, enhancements fail to become ready, or same-condition staging still shows equivalent multi-second uninterrupted entry stalls."
  },
  "candidates": [
    {
      "id": "cooperative-ordered-enhancement-loading",
      "selected": true,
      "reason": "Preserves every existing enhancement and semantic order while giving rendering/input a scheduling opportunity between expensive stages."
    },
    {
      "id": "idle-only-enhancement-loading",
      "selected": false,
      "reason": "requestIdleCallback-only loading can starve indefinitely under continuous animation and would make feature readiness timing unpredictable."
    },
    {
      "id": "remove-heavy-enhancements",
      "selected": false,
      "reason": "Would weaken established gameplay/presentation quality rather than fixing scheduling."
    }
  ],
  "implementation": {
    "paths": [
      "apps/village/src/main.js",
      "apps/village/src/mura-enhancements.js",
      "apps/village/tests/first-run-onboarding.test.mjs"
    ],
    "summary": "Add a first-paint boundary after entry, replace the monolithic static enhancement graph with ordered dynamic imports that yield between modules, and preserve final presentation ordering with explicit browser-turn yields."
  },
  "evidencePlan": {
    "objective": "reproducible-causality",
    "focusedTests": [
      "apps/village/tests/first-run-onboarding.test.mjs"
    ],
    "stagingAfter": "required",
    "limitations": [
      "Hosted Chromium/SwiftShader timing is directional rather than physical-device performance.",
      "Native assertion proves scheduling structure and order, not absolute milliseconds."
    ]
  },
  "receipt": {
    "repository": "charukun/soul-lineage",
    "pullRequest": 1171,
    "marker": "autonomous-receipt:village:village-entry-post-boot-yield-20260921"
  }
}
