{
  "schemaVersion": 2,
  "id": "replace-experiment-id",
  "game": "village",
  "mode": "hardening",
  "kind": "gameplay",
  "observation": {
    "summary": "REPLACE_PLAYER_OR_SYSTEM_OBSERVATION",
    "staging": {
      "kind": "immutable-staging",
      "sourceSha": "REPLACE_WITH_40_HEX_SHA",
      "reference": "REPLACE_IMMUTABLE_STAGING_ARTIFACT_OR_URL",
      "observedAt": "2026-09-20T00:00:00Z",
      "conditions": {
        "device": "REPLACE",
        "viewport": "REPLACE",
        "scenario": "REPLACE"
      },
      "notVerified": []
    },
    "evidence": [
      {
        "kind": "source",
        "revision": "REPLACE_WITH_40_HEX_SHA",
        "path": "REPLACE_PATH",
        "symbol": "REPLACE_SYMBOL",
        "statement": "REPLACE_VERIFIABLE_OBSERVATION"
      }
    ]
  },
  "hypothesis": {
    "cause": "REPLACE_THEME_LEVEL_CAUSE",
    "prediction": "REPLACE_THEME_LEVEL_OUTCOME",
    "falsifier": "REPLACE_THEME_LEVEL_DISPROVING_RESULT"
  },
  "candidates": [
    {
      "id": "candidate-a",
      "selected": true,
      "reason": "REPLACE_REASON"
    },
    {
      "id": "candidate-b",
      "selected": false,
      "reason": "REPLACE_REJECTION"
    }
  ],
  "implementation": {
    "paths": [
      "REPLACE_PATH"
    ],
    "summary": "REPLACE_CHANGE"
  },
  "evidencePlan": {
    "objective": "reproducible-causality",
    "focusedTests": [
      "REPLACE_LIGHTWEIGHT_EXISTING_TEST.test.mjs"
    ],
    "stagingAfter": "optional",
    "limitations": [
      "REPLACE_SCOPE_LIMITS"
    ]
  },
  "receipt": {
    "repository": "charukun/soul-lineage",
    "pullRequest": null,
    "marker": "autonomous-receipt:village:replace-experiment-id"
  },
  "themeKey": "replace-improvement-theme",
  "rootCauses": [
    {
      "key": "root-cause-a",
      "summary": "REPLACE_CAUSAL_PROBLEM",
      "prediction": "REPLACE_LOCAL_EXPECTED_CHANGE",
      "falsifier": "REPLACE_LOCAL_DISPROVING_RESULT",
      "paths": [
        "REPLACE_PATH"
      ]
    },
    {
      "key": "root-cause-b",
      "summary": "OPTIONAL_RELATED_CAUSAL_PROBLEM",
      "prediction": "OPTIONAL_LOCAL_EXPECTED_CHANGE",
      "falsifier": "OPTIONAL_LOCAL_DISPROVING_RESULT",
      "paths": [
        "REPLACE_RELATED_PATH"
      ]
    }
  ]
}
