{
  "schemaVersion": 2,
  "id": "kuumetsu-prey-guidance-20260921",
  "game": "kuumetsu",
  "mode": "evolution",
  "kind": "gameplay",
  "themeKey": "post-devour-next-prey-guidance",
  "rootCauses": [
    {
      "key": "feast-overwrites-mission-objective",
      "summary": "Post-devour next-prey guidance reuses and overwrites the mission objective heading/body, making quota/mission context compete with growth targeting.",
      "prediction": "Keeping the mission objective stable while putting prey power and distance in the dedicated tracker preserves both progress context and growth choice.",
      "falsifier": "The tracker still requires mutating the objective copy or staged After still loses the mission objective during next-prey guidance.",
      "paths": [
        "apps/demon/src/web/feast-hud.js"
      ]
    }
  ],
  "observation": {
    "summary": "Immutable source 50971dc is bound to Cloudflare version 37c0ff77. The staged hunt path was dispatched through repository browser-review (TAP -> 狩夜へ -> hunt). Source at that exact revision shows FeastHud.update overwrites #objective small/span with 次に狙う力 and PREY power after consume, so mission quota and growth target share one mutable slot.",
    "staging": {
      "kind": "immutable-staging",
      "sourceSha": "50971dc822ed9d0000f72c17b1bb357a309f735b",
      "reference": "https://37c0ff77-soul-lineage-demon-dev.c-okamoto.workers.dev/",
      "versionId": "37c0ff77-db3e-48bb-be11-bb3cab75f363",
      "observedAt": "2026-09-21T09:39:30Z",
      "conditions": {
        "viewport": "673x841",
        "scenario": "brand TAP -> 狩夜へ -> first hunt; exact artifact version.json verified from run 35584223372"
      },
      "notVerified": [
        "physical Pixel Fold feel",
        "browser-review result payload is not surfaced through GitHub connector"
      ]
    },
    "evidence": [
      {
        "kind": "source",
        "revision": "50971dc822ed9d0000f72c17b1bb357a309f735b",
        "path": "apps/demon/src/web/feast-hud.js",
        "symbol": "FeastHud.update",
        "statement": "When target exists, prey-bearing is populated, then #objective small/span are rewritten to 次に狙う力 / PREY power."
      }
    ]
  },
  "hypothesis": {
    "cause": "Mission progress and post-devour growth targeting are multiplexed into the same objective copy.",
    "prediction": "A dedicated prey tracker that includes desired power and distance can carry growth targeting without replacing mission progress.",
    "falsifier": "Mission text still gets replaced or the tracker no longer communicates target power."
  },
  "candidates": [
    {
      "id": "shorter-objective-overwrite",
      "selected": false,
      "reason": "Reduces duration but preserves the information collision."
    },
    {
      "id": "separate-prey-guidance-layer",
      "selected": true,
      "reason": "Uses the existing tracker for growth targeting and leaves mission progress stable."
    }
  ],
  "implementation": {
    "paths": [
      "apps/demon/src/web/feast-hud.js",
      "apps/demon/tests/hunt-loop-native.test.mjs"
    ],
    "summary": "Keep objective copy owned by HuntFlowUi; enrich prey-bearing with power, distance and aria label."
  },
  "evidencePlan": {
    "objective": "reproducible-causality",
    "focusedTests": [
      "apps/demon/tests/hunt-loop-native.test.mjs"
    ],
    "stagingAfter": "required",
    "limitations": [
      "Portable balance probe does not cover DOM ownership; native source assertion is causal evidence."
    ]
  },
  "receipt": {
    "repository": "charukun/soul-lineage",
    "pullRequest": 1296,
    "marker": "autonomous-receipt:kuumetsu:kuumetsu-prey-guidance-20260921"
  }
}
