{
  "schemaVersion": 2,
  "id": "kuumetsu-mobile-world-budget-20260921",
  "game": "kuumetsu",
  "mode": "polish",
  "kind": "gameplay",
  "themeKey": "hunt-entry-mobile-world-cost",
  "rootCauses": [
    {
      "key": "fixed-desktop-world-detail-on-mobile",
      "summary": "NightView.build synchronously generates 100 procedural forest trees and 130 edge props even at the 673px mobile observation viewport.",
      "prediction": "A viewport-bound decorative budget reduces mobile synchronous world-generation work while preserving full desktop density and all gameplay entities/rules.",
      "falsifier": "Mobile still receives the full decorative counts or immutable After shows no improvement in hunt-entry long-task/frame metrics.",
      "paths": [
        "apps/demon/src/web/view.js",
        "apps/demon/src/web/world-detail-budget.js"
      ]
    }
  ],
  "observation": {
    "summary": "On merged immutable staging, first-hunt entry retained a severe synchronous stall: browser evidence recorded p95 1150ms, an 18119ms long task around hunt entry, and immediate staged fps of 1. Source shows decorative world generation uses fixed desktop-scale counts on the 673px viewport.",
    "staging": {
      "kind": "immutable-staging",
      "sourceSha": "fdcb1f5a158b490242187fffcfd1f95b83e01e15",
      "reference": "https://925f2d38-soul-lineage-demon-dev.c-okamoto.workers.dev/",
      "observedAt": "2026-09-21T12:54:51Z",
      "conditions": {
        "viewport": "673x841",
        "scenario": "fresh profile -> first hunt",
        "browserRun": 35602143322
      },
      "notVerified": [
        "physical Pixel Fold frame time",
        "GPU-specific cost split"
      ]
    },
    "evidence": [
      {
        "kind": "browser",
        "revision": "fdcb1f5a158b490242187fffcfd1f95b83e01e15",
        "path": "immutable preview",
        "symbol": "browser metrics",
        "statement": "p95 1150ms; max hunt-entry long task 18119ms; staged snapshot fps 1."
      },
      {
        "kind": "source",
        "revision": "fdcb1f5a158b490242187fffcfd1f95b83e01e15",
        "path": "apps/demon/src/web/view.js",
        "symbol": "NightView.build",
        "statement": "Decorative forest and edge loops use fixed counts 100 and 130 independent of viewport."
      }
    ]
  },
  "hypothesis": {
    "cause": "Mobile hunt entry pays desktop decorative generation cost synchronously before play can settle.",
    "prediction": "Reducing only decorative density on compact viewports lowers entry blocking while preserving gameplay geometry, NPCs, Tidebreak and saves.",
    "falsifier": "Focused budget test fails or immutable After long-task/frame metrics do not improve."
  },
  "candidates": [
    {
      "id": "viewport-detail-budget",
      "selected": true,
      "reason": "Cuts only decorative generation work and preserves full desktop density."
    },
    {
      "id": "remove-world-decoration",
      "selected": false,
      "reason": "Would damage the authored visual identity instead of scaling it."
    }
  ],
  "implementation": {
    "paths": [
      "apps/demon/src/web/view.js",
      "apps/demon/src/web/world-detail-budget.js",
      "apps/demon/tests/hunt-loop-native.test.mjs"
    ],
    "summary": "Add a pure viewport detail budget and use it only for decorative forest/edge counts."
  },
  "evidencePlan": {
    "objective": "reproducible-causality",
    "focusedTests": [
      "apps/demon/tests/hunt-loop-native.test.mjs"
    ],
    "stagingAfter": "required",
    "limitations": [
      "Portable balance probe does not cover rendering cost.",
      "Hosted Chromium timing is directional, not a physical Pixel Fold benchmark."
    ]
  },
  "receipt": {
    "repository": "charukun/soul-lineage",
    "pullRequest": 1314,
    "marker": "autonomous-receipt:kuumetsu:kuumetsu-mobile-world-budget-20260921"
  }
}
